Model,Manufacturer,Firebox Volume,Emission Rate (grams/hr),Heat Ouput Range (BTUs),Heat Output Upper (BTUs),Heat Output Lower (BTUs),Efficiency,Type,Subtype,Fuel Type,Test Method,CO,NSPS Compliance 2020
"GV230GL, ML230GL ",Innovative Hearth Products,2.28,1.7,33911-12631,33911,12631,74,Wood Stove,Non-Catalytic Stove,Crib Wood,,1.78,Yes
Vermont Castings Defiant 1975-CAT-C ,Hearth and Home Technologies,3.25,1.3,25471-11974,25471,11974,78,Wood Stove,Catalytic Stove,Crib Wood,,1.46,Yes
"ComfortBilt HP22N, HP22, and HP22i Insert ","SMG Hearth and Home, LLC",Not Applicable,1,40689-12820,40689,12820,81,Pellet Stove,Non-Catalytic Stove,Wood Pellets,,0,Yes
King KE40,"Blaze King Industries, Inc.",4.55,1,38516-10392,38516,10392,81,Wood Stove,Catalytic Stove,Crib Wood,,0.49,Yes
"6100 B Series (6140 B, 6143 B, 6148 B, 6170 B)",Morso Jernstoberi A/S,0.522,1.8,19067-11892,19067,11892,74,Wood Stove,Non-Catalytic Stove,Crib Wood,,0.79,Yes
"4840, KP500, AP5000, Comfort Glow WMPS7000, DuraHeat DHPS7000",United States Stove Company,Not Applicable,1.4,12161-7164,12161,7164,72,Pellet Stove,Non-Catalytic Stove,Wood Pellets,,0.31,Yes
"6041, 6041I, SP6000 ",United States Stove Company,Not Applicable,1.3,21811-7540,21811,7540,58,Pellet Stove,Non-Catalytic Stove,Wood Pellets,,0.46,Yes
"US1269E, USLW900, CGWS900",United States Stove Company,1.145,1.8,29234-26300,29234,26300,67,Wood Stove,Non-Catalytic Stove,Crib Wood,,1.87,Yes
"GW1949, AP77, SW1117",United States Stove Company,Not Applicable,0.8,27220-12706,27220,12706,70,Pellet Stove,Non-Catalytic Stove,Wood Pellets,,0.24,Yes
"STUV 1668IN, STUV 1668 CUBE, STUV 1668H, STUV 1668-Z",STUV AMERICA Inc.,1.94,1.7,23727-22179,23727,22179,66,Wood Stove,Non-Catalytic Stove,Crib Wood,,1.7,Yes
"US1800E, VG1820, AW1820E, CH18, NM690, SW1.8, AHWS1820, KW1820, Comfort Glow CGWI1800, DuraHeat DHWI1800",United States Stove Company,1.2,1.8,28445-10689,28445,10689,73,Wood Stove,Non-Catalytic Stove,Crib Wood,,1.2,Yes
"Norflam Harbor Light, Sierra Flame Lynwood W76, SBI Cape Town 1800",Dovre Incorporated,1.554,1.9,51616-13927,51616,13927,76,Wood Stove,Non-Catalytic Stove,Cord Wood,,1.3,Yes
"Quadra-Fire 21M-ACC-C, Discovery-1-C, FF-WP-100

",Hearth and Home Technologies,1.48,1.7,29322-13585,29322,13585,76,Wood Stove,Non-Catalytic Stove,Crib Wood,,1.5,Yes
"Quadra-Fire 43M-ACC-C, 43ST-ACC-C, Discovery-III-C, FF-WP-300",Hearth and Home Technologies,2.26,1.6,36757-13239,36757,13239,74,Wood Stove,Non-Catalytic Stove,Crib Wood,,1.9,Yes
Charnwood Skye E700,A. J. Wells and Sons LTD,0.82,1.7,29850-10520,29850,10520,77,Wood Stove,Non-Catalytic Stove,Cord Wood,,0.8,Yes
"Bari 8171, Bari Plus 8172
",Hearthstone Quality Home Heating Products Inc.,1.25,0.94,26036-14065,26036,14065,76,Wood Stove,Hybrid,Crib Wood,,0.07,Yes
"Model 91, Carolina 92",New Buck Corporation (Buck Stove Corp.),3.07,1.3,43190-14206,43190,14206,80,Wood Stove,Catalytic Stove,Crib Wood,,0.6,Yes
"US1100E, US1100EC, VG1120, AW1120E, CH11, NM680, SW1.2, AHWS1120, US1100E-P, US1100E-L, US1100E-BP, US1100E-BL, AW1120E-P, AW1120E-L, 1120E-BP, AW1120E-BL, VG1120-P, VG1120-L, VG1120-BP, VG1120-BL, US1100EC-P, US1100EC-L, US1100EC-BP, US1100EC-BL, King KW1100E-L, CH11-L, KW12, DHWS 1500, CGWS1500",United States Stove Company,1.31,2.4,39683-13846,39683,13846,66,Wood Stove,Non-Catalytic Stove,Cord Wood,,1.5,Yes
ComfortBilt HP50S,"SMG Hearth and Home, LLC",Not Applicable,1.7,39170-17794,39170,17794,80,Pellet Stove,Hybrid,Wood Pellets,,0,Yes
"Winslow PI40GL, Winslow PS40GL",Innovative Hearth Products,Not Applicable,1.5,30916-8949,30916,8949,65,Pellet Stove,Non-Catalytic Stove,Wood Pellets,,0.34,Yes
Echo-Comstock II,Thelin Company Inc.,Not Applicable,0.88,26783-16754,26783,16754,75,Pellet Stove,Non-Catalytic Stove,Wood Pellets,,0.15,Yes
Providence,Thelin Company Inc.,Not Applicable,1.1,23746-10461,23746,10461,64,Pellet Stove,Non-Catalytic Stove,Wood Pellets,,0.3,Yes
"S2300 FS, S2300 PB","Sierra Products, Inc.",2.36,2.2,36591-14209,36591,14209,67,Wood Stove,Non-Catalytic Stove,Cord Wood,,1.9,Yes
Six 66-50,STUV AMERICA Inc.,1.08,1.9,17121-14802,17121,14802,68,Wood Stove,Non-Catalytic Stove,Crib Wood,,1.35,Yes
"WS110, C110, D110, H110, J110, N110, R110, T110, V110","Enerco Group, Inc.  ",2.28,0.99,49138-17400,49138,17400,70,Wood Stove,Non-Catalytic Stove,Cord Wood,,1.5,Yes
Whitney,Sun Mountain Stove Works Inc.,Not Applicable,0.47,25102-7591,25102,7591,68,Pellet Stove,Non-Catalytic Stove,Wood Pellets,,0.058,Yes
"1.4 Series (Osburn 950, Escape 1200, Gateway 1400, Solution 1.4, Spark II, Fox, Déco Nano, S250, Harmony 1.4, HES140, Blue Ridge 100)

","Stove Builder International, Inc.",1.55,1.8,26500-12100,26500,12100,74,Wood Stove,Non-Catalytic Stove,Cord Wood,,1.2,Yes
"Enviro - Meridian-2, Meridian FPI-2, Meridian Cast Iron-2, Regency Greenfire GF55-2, GFI55-2
","Sherwood Industries, Ltd.",Not Applicable,1.8,32739-7751,32739,7751,75,Pellet Stove,Non-Catalytic Stove,Wood Pellets,,0.13,Yes
"Enviro Mini 2, Enviro P3-2 Regency Greenfire GF40-2","Sherwood Industries, Ltd.",Not Applicable,0.54,23892-6881,23892,6881,80,Pellet Stove,Non-Catalytic Stove,Wood Pellets,,0.03,Yes
GAP 2020,Independent Stove LLC,Not Applicable,0.84,23002-8026,23002,8026,51,Pellet Stove,Non-Catalytic Stove,Wood Pellets,,0.225,Yes
"Enviro M55-FS-2, Enviro M55C-FS-2, Enviro M55C-FPI-2, FPI GC60-2, and FPI GCI60-2
","Sherwood Industries, Ltd.",,1.9,38437-7817,38437,7817,78,Pellet Stove,Non-Catalytic Stove,,,0.4,Yes
"2.1 Series (Destination 1.9, Matrix 1900, CW2100, Green Mountain Insert 50, HEI90, Archway 1500, Blue Ridge 150-I)","Stove Builder International, Inc.",1.03,1.5,31700-8500,31700,8500,75,Wood Stove,Non-Catalytic Stove,Cord Wood,,0.6,Yes
"Bakeheart, Warmheart",Esse Engineering Ltd.,1.09,2.15,48685-10001,48685,10001,75,Wood Stove,Non-Catalytic Stove,Cord Wood,,1.286,Yes
"Ladera-D, WRT3920-B",Innovative Hearth Products,1.71,1.66,53266-12023,53266,12023,59,Wood Stove,Non-Catalytic Stove,Cord Wood,,1.3,Yes
Mansfield 8013,Hearthstone Quality Home Heating Products Inc.,2.88,0.54,32200-14043,32200,14043,78,Wood Stove,Hybrid,Crib Wood,,0.82,Yes
S8000II TEC,"Sierra Products, Inc.",2.93,1.7,71267-16671,71267,16671,78,Wood Stove,Catalytic Stove,Cord Wood,,0.6,Yes
STUV SIX 76-55,STUV AMERICA Inc.,1.55,1.86,22732-20473,22732,20473,68,Wood Stove,Non-Catalytic Stove,Crib Wood,,1.42,Yes
STUV SIX 76-60,STUV AMERICA Inc.,1.58,1.9,23388-22079,23388,22079,68,Wood Stove,Non-Catalytic Stove,Crib Wood,,1.43,Yes
Answer NexGen Hybrid,"Travis Industries, Inc",1.4,1.4,38594-12252,38594,12252,80,Wood Stove,Hybrid,Crib Wood,,1.322,Yes
"P158, P158 D, and P158 T ",Gruppo Piazzetta S.P.A.,Not Applicable,0.79,31491-12482,31491,12482,83,Pellet Stove,Non-Catalytic Stove,Wood Pellets,,0.077,Yes
"P163, P163 D, and P163 T",Gruppo Piazzetta S.P.A.,Not Applicable,0.89,38656-12778,38656,12778,82,Pellet Stove,Non-Catalytic Stove,Wood Pellets,,0.011,Yes
Clydesdale 8492,Hearthstone Quality Home Heating Products Inc.,2.35,1.16,32588-14829,32588,14829,79,Wood Stove,Hybrid,Crib Wood,,1.1,Yes
"5780-E, AP5780-E, VG5780-E, SP5780-E, SP58-E",United States Stove Company,Not Applicable,1.1,35041-8215,35041,8215,76,Pellet Stove,Non-Catalytic Stove,Wood Pellets,,0.5,Yes
"KP5513, KP5513-P, KP5513-L, US5513, US5513-P, US5513-L, AP5613, AP5613-P, AP5613-L, VG5713, VG5713-P, VG5713-L, Little E (SP500), 5501S-XH, KP5513-W, US5513-W, AP5613-W, VG5713-W",United States Stove Company,Not Applicable,1.5,24676-10609,24676,10609,76,Pellet Stove,Non-Catalytic Stove,Wood Pellets,,0.16,Yes
"Pioneer, Galileo, Score, Magellan, Hubble, Messenger, Apollo, Gemini, Spirit, Kepler,
Kocher, Cocinera, Fornello, Kouzina, Kuchenka, Komfyr, Hubble(R), Apollo(R), Gemini(R),
Spirit(R), Kepler(R)",J. A. Roby Inc. ,3.01,1.6,55107-18372,55107,18372,72,Wood Stove,Non-Catalytic Stove,Cord Wood,,1.69,Yes
RMH-2 ,Liberator Rocket Heaters,Not Applicable,0.4,-20590,,20590,68,Pellet Stove,Non-Catalytic Stove,Wood Pellets,,0.4,Yes
F35,"Jotul North America (Jotul U.S.A., Inc.)",1.57,1.2,59443-13533,59443,13533,69,Wood Stove,Non-Catalytic Stove,Cord Wood,,1.35,Yes
"Prescott II EXP, Prescott II EXL",St. Croix Stoves (Johnson Gas Appliance Company),Not Applicable,0.7,29788-10248,29788,10248,81,Pellet Stove,Non-Catalytic Stove,Wood Pellets,,0.064,Yes
"KP5517, KP5517-P, KP5517-L,KP5517-W,US5517, US5517-P, US5517-L,US5517-W, AP5617, AP5617-P, AP5617-L,AP5617-W,VG5717, VG5717-P, VG5717-L,VG5717-W, SP33",United States Stove Company,Not Applicable,1.6,30884-11871,30884,11871,77,Pellet Stove,Non-Catalytic Stove,Wood Pellets,,0.28,Yes
"KP5522, KP5522-P, KP5522-L, KP5522-W, US5522, US5522-P, US5522-L, US5522-W, AP5622, AP5622-P, AP5622-L, AP5622-W, VG5722, VG5722-P, VG5722-L, VG5722-W, SP1100, SP1100-W, KP130-B",United States Stove Company,Not Applicable,1.5,32591-13640,32591,13640,76,Pellet Stove,Non-Catalytic Stove,Wood Pellets,,0.2,Yes
"Pleasant Hearth Small Wood Stove SWS-1200, SWS-1200-B, HWS-1200, HWS-1200-B, PWS-
1200-B PH1200WS, WSL-1200, PH1200WS-B, WSL-1200-B, GWS-1200-B, WS-1200, GWS-1200
WS-1200-B",GHP Group,1.53,1.9,56107-14295,56107,14295,78,Wood Stove,Non-Catalytic Stove,Cord Wood,,1.5,Yes
"WS100, C100, D100, H100, J100, N100, R100, T100, V100","Enerco Group, Inc.  ",1.84,1.84,48573-15447,48573,15447,73,Wood Stove,Non-Catalytic Stove,Cord Wood,,1.54,Yes
"TH-100, US500E, AW520E, VG520, SW500, CH500, KW500, CGWS750",United States Stove Company,0.59,1.7,26028-10652,26028,10652,75,Wood Stove,Non-Catalytic Stove,Crib Wood,,0.78,Yes
Endeavor NexGen-Hybrid,"Travis Industries, Inc",2.66,1.2,31922-10252,31922,10252,80,Wood Stove,Hybrid,Crib Wood,,0.218,Yes
"2.5R Series (Solution 2.5 ZC II, Stratford II, FP10 Lafayette II, FP12 Mundo II, HE250R, Destination 2.7, Matrix 2700, FP10 Lafayette IIS, WFP-75 8411, HE275, HE275CF, Green Mountain Insert 90 8460, St. Clair 2500)","Stove Builder International, Inc.",1.94,1.2,60700-12700,60700,12700,64,Wood Stove,Non-Catalytic Stove,Cord Wood,,1.6,Yes
Fusion 24 24FN,"Foyers Supreme, Inc",2.94,1.5,44605-16266,44605,16266,65,Wood Stove,Non-Catalytic Stove,Cord Wood,,2.4,Yes
Ashby-P II,St. Croix Stoves (Johnson Gas Appliance Company),Not Applicable,1.3,28966-9696,28966,9696,80,Pellet Stove,Non-Catalytic Stove,Wood Pellets,,0.014,Yes
Sahara,Gruppo Piazzetta S.P.A.,Not Applicable,1.3,39422-15224,39422,15224,83,Pellet Stove,Non-Catalytic Stove,Wood Pellets,,0,Yes
"US1261E, USLW900E",United States Stove Company,1.145,1.9,33557-28784,33557,28784,68,Wood Stove,Non-Catalytic Stove,,,1.65,Yes
"5660 B, 5600 B Standard",Morso Jernstoberi A/S,1.15,1.2,43499-15774,43499,15774,71,Wood Stove,Non-Catalytic Stove,Cord Wood,,0.96,Yes
Independence PS21,"Freedom Stoves, LLC",Not Applicable,1.6,27884-8526,27884,8526,78,Pellet Stove,Non-Catalytic Stove,Wood Pellets,,0,Yes
42 Apex NexGen-Hybrid,"Travis Industries, Inc",3.18,1.2,38005-9795,38005,9795,77,Wood Stove,Hybrid,Crib Wood,,0.85,Yes
"Evergreen NexGen-Hybrid Free-Standing, Evergreen NexGen-Hybrid Insert","Travis Industries, Inc",2.18,1.2,31641-10768,31641,10768,77,Wood Stove,Hybrid,Crib Wood,,0.64,Yes
HP 40,"SMG Hearth and Home, LLC",Not Applicable,0.74,26224-13458,26224,13458,81,Pellet Stove,Non-Catalytic Stove,Wood Pellets,,0.3,Yes
Large Flush Wood NexGen-Hybrid,"Travis Industries, Inc",2.72,0.8,39829-11162,39829,11162,78,Wood Stove,Hybrid,Crib Wood,,0.56,Yes
"Bistro Series (Bistro, Gusto, Pyra, 600, HEC240, IW600)","Stove Builder International, Inc.",2.26,2,50200-14300,50200,14300,76,Wood Stove,Non-Catalytic Stove,Cord Wood,,1,Yes
"Francesca 2015 (01-US-001A), Nicole (2005ERU1), RV 80 Ceramica (014-US-007A), Francesca Top Outlet",Ravelli SRL,Not Applicable,1,28231-11695,28231,11695,81,Pellet Stove,Non-Catalytic Stove,Wood Pellets,,0.104,Yes
44 Elite NexGen-Hybrid,"Travis Industries, Inc",4.2,1.1,54510-12016,54510,12016,81,Wood Stove,Hybrid,Crib Wood,,0.48,Yes
"Lincoln 8060, Green Mountain 20 (8620), Dorset (8330)",Hearthstone Quality Home Heating Products Inc.,1,1.1,20507-14545,20507,14545,79,Wood Stove,Hybrid,Crib Wood,,0.6,Yes
Castle Serenity 41278,"ARDISAM, Inc. ",Not Applicable,1,26493-12807,26493,12807,78,Pellet Stove,Non-Catalytic Stove,Wood Pellets,,0,Yes
"Nexo 100 ManualNexo 100 Classic Manual, Nexo 120 ManualNexo 120 Classic Manual, 
Nexo 140 ManualNexo 140 Classic Manual, Nexo 160 ManualNexo 160 Classic Manual, Nexo 
185 ManualNexo 185 Classic Manual, Nexo 100 G ManualNexo 100 G Classic Manual, Nexo 
120 G ManualNexo 120 G Classic Manual, Nexo 140 G ManualNexo 140 G Classic Manual, 
Nexo 160 G ManualNexo 160 G Classic Manual, Nexo 185 G ManualNexo 185 G Classic 
Manual",Rais A/S,1.48,1.1,20238-13149,20238,13149,72,Wood Stove,Non-Catalytic Stove,Crib Wood,,2.1,Yes
Medium Flush Wood NexGen-Hybrid,"Travis Industries, Inc",2.23,1.2,39456-11076,39456,11076,77,Wood Stove,Hybrid,Crib Wood,,0.42,Yes
"WS090, C090, D090, H090, J090, N090, R090, T090, V090","Enerco Group, Inc.  ",1.16,1.9,27513-26970,27513,26970,68,Wood Stove,Non-Catalytic Stove,Crib Wood,,1.4,Yes
P42i-TC,Hearth and Home Technologies,Not Applicable,1,32782-5637,32782,5637,79,Pellet Stove,Non-Catalytic Stove,Wood Pellets,,0.31,Yes
"1.7R Series: Blackcomb II, Escape 1500, Deco II, Columbia II, Savannah II, FW2800, Osburn 1700, Inspire 1700, Harmony 1.7, Solution 1.7, Blue Ridge 200P, Blue Ridge 200L, HES170, Gateway 1700, Escape 1500-I, CW2800, Osburn 1700-I, Matrix 1700-I, Inspire 1700-I, Destination 1.7, Solution 1.7-I, Blue Ridge 200-I, HEI170, Archway 1700","Stove Builder International, Inc.",1.86,2.4,52200-9800,52200,9800,68,Wood Stove,Non-Catalytic Stove,Cord Wood,,1.7,Yes
"F2500-1, I2500-1",FPI/Regency Fireplace Products,2.3,1.4,29795-13580,29795,13580,78,Wood Stove,Catalytic Stove,Crib Wood,,0.51,Yes
"H1 Hybrid, H2 Hybrid, H3 Hybrid",Aduro AS,0.653,1.2,53832-27630,53832,27630,80,Wood Stove,Non-Catalytic Stove,Cord Wood,,1.5,Yes
"H1 Hybrid, H2 Hybrid, H3 Hybrid",Aduro AS,Not Applicable,0.4,21240-7451,21240,7451,80,Pellet Stove,Non-Catalytic Stove,Wood Pellets,,0.03,Yes
"K-181 Series: Aspen LE-1, Tamarack LE-1, Aberdeen LE-1, and Alpine LE-1",Kuma Stove And Iron Works,1.821,1.1,29153-12764,29153,12764,78,Wood Stove,Catalytic Stove,Crib Wood,,0.45,Yes
Shaker,Wittus Inc.,1.46,1.8,21399-18218,21399,18218,76,Wood Stove,Catalytic Stove,Crib Wood,,0.87,Yes
TN25 C,Pacific Energy Fireplace Products Limited,1.98,1.1,29202-13447,29202,13447,76,Wood Stove,Catalytic Stove,Crib Wood,,1.3,Yes
HTP Bay,"Heat Tech Industries, LLC. ",Not Applicable,1.7,20846-7181,20846,7181,64,Pellet Stove,Non-Catalytic Stove,Wood Pellets,,0.71,Yes
HTP Standard,"Heat Tech Industries, LLC. ",Not Applicable,1.2,19455-8419,19455,8419,67,Pellet Stove,Non-Catalytic Stove,Wood Pellets,,0.35,Yes
"CI2700-1, HI500-1",FPI/Regency Fireplace Products,1.83,1.1,27168-14291,27168,14291,77,Wood Stove,Catalytic Stove,Crib Wood,,0.5,Yes
Eclipse-P II,St. Croix Stoves (Johnson Gas Appliance Company),Not Applicable,1.9,37669-15784,37669,15784,77,Pellet Stove,Non-Catalytic Stove,Wood Pellets,,0.017,Yes
Element-P II,St. Croix Stoves (Johnson Gas Appliance Company),Not Applicable,1.1,31773-9318,31773,9318,79,Pellet Stove,Non-Catalytic Stove,Wood Pellets,,0.005,Yes
F3500B-1,FPI/Regency Fireplace Products,3.024,1.1,30659-13650,30659,13650,76,Wood Stove,Catalytic Stove,Crib Wood,,1.8,Yes
Frontier II,Hearth and Home Technologies,Not Applicable,1.6,37362-18304,37362,18304,78,Pellet Stove,Non-Catalytic Stove,Wood Pellets,,1.5,Yes
Hastings II,St. Croix Stoves (Johnson Gas Appliance Company),Not Applicable,1.2,33190-12082,33190,12082,79,Pellet Stove,Non-Catalytic Stove,Wood Pellets,,0.014,Yes
"SP1000E, KP1000E, AP1000E, US1000E",United States Stove Company,Not Applicable,1,39121-6580,39121,6580,75,Pellet Stove,Non-Catalytic Stove,Wood Pellets,,0.19,Yes
Nova C,MF Fire,1.7,1.9,28140-23654,28140,23654,71,Wood Stove,Catalytic Stove,Crib Wood,,0.94,Yes
"Grecale, Grecale Glass, Round, Round Glass, Ethesia, Ethesia Glass",Dielle SpA,Not Applicable,1,35644-13655,35644,13655,75,Pellet Stove,Non-Catalytic Stove,Wood Pellets,,0.214,Yes
"K-251 Series: Ashwood LE-1, Wood Classic LE-1, Cambridge LE-1, Cascade LE-1",Kuma Stove And Iron Works,2.56,1.1,30612-11219,30612,11219,78,Wood Stove,Catalytic Stove,Crib Wood,,0.49,Yes
Rockport NexGen-Hybrid,"Travis Industries, Inc",2.04,0.73,42722-12594,42722,12594,80,Wood Stove,Catalytic Stove,Crib Wood,,0.493,Yes
F445,"Jotul North America (Jotul U.S.A., Inc.)",2.03,0.49,35722-13212,35722,13212,72,Wood Stove,Catalytic Stove,Crib Wood,,0.6,Yes
"65R Series: Eco-65R, Blue Ridge P120","Stove Builder International, Inc.",Not Applicable,0.77,28526-6966,28526,6966,77,Pellet Stove,Non-Catalytic Stove,Wood Pellets,,0.22,Yes
"Europa 75a, Rafael 55a",FlamPoint EnerG,Not Applicable,0.08,28051-7144,28051,7144,83,Pellet Stove,Non-Catalytic Stove,Wood Pellets,,0.054,Yes
"Giulia Air, Valentina Air N",Laminox,Not Applicable,1.6,48694-26918,48694,26918,84,Pellet Stove,Non-Catalytic Stove,Wood Pellets,,0.74,Yes
HP42-Alpine,"SMG Hearth and Home, LLC",Not Applicable,1.1,42370-14567,42370,14567,86,Pellet Stove,Non-Catalytic Stove,Wood Pellets,,0.041,Yes
"Phenix Air, Lydia Natural",Laminox,Not Applicable,1.3,35281-14245,35281,14245,79,Pellet Stove,Non-Catalytic Stove,Wood Pellets,,0.08,Yes
HP41 - Alpine,"SMG Hearth and Home, LLC",Not Applicable,1.6,32155-12744,32155,12744,80,Pellet Stove,Non-Catalytic Stove,Wood Pellets,,0.072,Yes
HP75C,"SMG Hearth and Home, LLC",Not Applicable,1.4,43298-10525,43298,10525,81,Pellet Stove,Non-Catalytic Stove,Wood Pellets,,0.089,Yes
36 Elite NexGen-Hybrid,"Travis Industries, Inc",3.135,0.6,47514-10733,47514,10733,80,Wood Stove,Hybrid,Crib Wood,,0.548,Yes
"Quadra-Fire Pioneer III-ARC & Quadra-Fire – Pioneer III -REC Wood Heater Model Line, 
Models: Heat & Glo Pioneer-III-ARC, Heat & Glo Pioneer-III-REC, Heatilator Pioneer-III-ARC, 
Heatilator Pioneer-III-REC, Majestic Pioneer-III-ARC, Majestic Pioneer-III-REC",Hearth and Home Technologies,4.06,1.3,18341-17665,18341,17665,68,Wood Stove,Non-Catalytic Stove,Crib Wood,,2,Yes
"US2000 Model Line: AW2020, AW2020-L, US2000-L, US2000-BL, US2000-BP, US2000-P, 
AW2020-P, AW2020-BP, AW2020-BL, KW2000-P, KW2000, KW2020, KW20, KW2000-L, CH20E, 
VG2020E-P, VG2020E-L, VG2020E-BP, VG2020E-BL, CGWS2000, US2000-WP, US2000-WL, 
AW2020-W, AW2020-WP, VG2020-W, VG2020E-W, KW2000-W, KW2020-W, SW2.0E, KWS2020, US2000-W",United States Stove Company,1.63,1.6,34130-11565,34130,11565,70,Wood Stove,Non-Catalytic Stove,Crib Wood,,1.9,Yes
"T2100GLS, C210AGLS, C210TGLS, S210AGLS, WXS2021WSS",Innovative Hearth Products,2,1.5,35000-11600,35000,11600,73,Wood Stove,Non-Catalytic Stove,Crib Wood,,1.7,Yes
"US2500E, AW2520E, VG2520, CH25, NM1190, SW2.5, AHWS2520, US2500E-P, US2500E-L, US2500E-BP, US2500E-BL, AW2520E-P, AW2520E-L, AW2520E-BP, AW2520E-BL, VG2520-P, VG2520-L, VG2520-BP, VG2520-BL, KW2500E-L, KW25, Comfort Glow CGWS2500, DuraHeat DHWS2500",United States Stove Company,2.73,2.4,50470-20053,50470,20053,72,Wood Stove,Non-Catalytic Stove,Cord Wood,,1.49,Yes
"16 IN Model Line: Lumis 16 (16 IN), Flair 25 (16 IN), Regal 16 (16IN)","Foyers Supreme, Inc",1.26,0.95,27042-9436,27042,9436,66,Wood Stove,Non-Catalytic Stove,Crib Wood,,1.5,Yes
"Alterra Pro I3000 Series (I300R, I300A)",FPI/Regency Fireplace Products,2.92,0.95,33155-13794,33155,13794,78,Wood Stove,Catalytic Stove,Crib Wood,,0.44,Yes
"L 800 ZC, L 800 Module, L 800 Insert",Spartherm,1.56,1.3,20406-19931,20406,19931,71,Wood Stove,Non-Catalytic Stove,Crib Wood,,0.8,Yes
"NEO 1.6 LE2 Model Line (Vista LE2, Vista Classic LE2, NEO 1.6 LE2, Alderlea T4 LE2, Vista Insert LE2, NEO 1.6 Insert LE2)",Pacific Energy Fireplace Products Limited,1.37,1.6,30149-12315,30149,12315,75,Wood Stove,Non-Catalytic Stove,Crib Wood,,1.4,Yes
F602 V3,"Jotul North America (Jotul U.S.A., Inc.)",0.79,1.4,23415-5994,23415,5994,77,Wood Stove,Catalytic Stove,Crib Wood,,1.3,Yes
"FBX S, FBX S+, FBX T, FBX R, FBX BUMP, ZEFIRO",Dielle SpA,Not Applicable,1.9,29464-16320,29464,16320,79,Pellet Stove,Non-Catalytic Stove,Wood Pellets,,0.217,No
Liberty NexGen-Hybrid,"Travis Industries, Inc",4.14,0.9,47138-11598,47138,11598,80,Wood Stove,Catalytic Stove,Crib Wood,,0.484,Yes
"5770E, AP5770E, VG5770E, US5770E, KP5770E, KP5770E-W, CGPS2100, DH3000, BHPS30",United States Stove Company,Not Applicable,1.1,23449-10300,23449,10300,78,Pellet Stove,Non-Catalytic Stove,Wood Pellets,,0.1,Yes
"5790E, AP5790E, VG5790E, KP5790E, KP5790-W, US5790E, CGPS2200, DH4800, BHPS48",United States Stove Company,Not Applicable,1,36300-8950,36300,8950,75,Pellet Stove,Hybrid,Wood Pellets,,0.25,Yes
"F2450-2, i2450-2, Hi2450-2",FPI/Regency Fireplace Products,2.24,1.6,29986-12903,29986,12903,70,Wood Stove,Non-Catalytic Stove,Crib Wood,,2.1,Yes
"Heat & Glo Pioneer-II-ARC, Heat & Glo Pioneer-II-REC, Heat & Glo Northstar-D, Heatilator C40-D, Majestic, WarmMajic-D, Heatilator Pioneer-II-ARC, Majestic Pioneer-II-ARC, Heatilator Pioneer-II-REC, Majestic Pioneer-II-REC",Hearth and Home Technologies,2.75,1.7,21357-20498,21357,20498,69,Wood Stove,Non-Catalytic Stove,Crib Wood,,1.7,Yes
"Lumis 22 – Soapstone, Regal 22 – Soapstone, Flair 29, Lumis 22 - Cast Iron, Regal 22 – Cast Iron","Foyers Supreme, Inc",1.91,1.3,19559-10076,19559,10076,67,Wood Stove,Non-Catalytic Stove,Crib Wood,,2.2,Yes
"NEO 2.5 LE2, NEO 2.5 Insert LE2",Pacific Energy Fireplace Products Limited,1.88,1.6,29536-13240,29536,13240,73,Wood Stove,Non-Catalytic Stove,Crib Wood,,1.6,Yes
"Everest III Series: Everest III, HE325R, Dallaire, St. Clair 3000R, Solution 3.0 ZC","Stove Builder International, Inc.",2.61,1.9,78200-23900,78200,23900,65,Wood Stove,Non-Catalytic Stove,Cord Wood,,1.7,Yes
"Mini Wood Stove: WS080, C080, D080, HO80, J080, N080, R080, T080, V080","Enerco Group, Inc.  ",0.57,1.6,26631-10710,26631,10710,72,Wood Stove,Non-Catalytic Stove,Crib Wood,,0.74,Yes
"F1150-1, i1150-1, Ci1150-1, Hi1150-1",FPI/Regency Fireplace Products,0.89,1.3,27353-12700,27353,12700,71,Wood Stove,Non-Catalytic Stove,Crib Wood,,1.1,Yes
"Medium Wood Stove Series: MWS-2200L, MWS-2200LB, MWS-2200LE, MWS-2200P, MWS-2200PB, MWS-2200PE, 2200L-MWS, 2200LB-MWS, 2200LE-MWS, 2200P-MWS, 2200PB-MWS, 2200PE-MWS, MWS-2200LZ, MWS-2200LBZ, MWS-2200LEZ, MWS-2200PZ, MWS-2200PBZ, MWS-2200PEZ, 2200LZ-MWS, 2200LBZ-MWS, 2200LEZ-MWS, 2200PZ-MWS, 2200PBZ-MWS, 2200PEZ-MWS, HCSM22L, HCSM22LB, HCSM22LE, HCSM22P, HCSM22PB, HCSM22PE",GHP Group,1.94,1.8,44459-12335,44459,12335,72,Wood Stove,Non-Catalytic Stove,Crib Wood,,1.802,Yes
Mini Me,"509 Fabrications, Inc.",Not Applicable,0.36,29388-12567,29388,12567,76,Pellet Stove,Non-Catalytic Stove,Wood Pellets,,0.22,Yes
"Spartherm M 700 Series: Spartherm M 700 Insert, Spartherm M 700 ZC, and Spartherm M 700 Module",Spartherm,1.58,1.7,24906-24269,24906,24269,66,Wood Stove,Non-Catalytic Stove,Crib Wood,,1,Yes
"Spartherm S 600 Insert, Spartherm S 600 ZC, Spartherm S 600 Module",Spartherm,0.94,1.8,21299-20345,21299,20345,62,Wood Stove,Non-Catalytic Stove,Crib Wood,,0.8,Yes
"Green Mountain 80-1 (Model 8681), Okemo (Model 8380), Hipster 30 (Model 8280)",Hearthstone Quality Home Heating Products Inc.,3.16,0.53,33424-14846,33424,14846,80,Wood Stove,Hybrid,Crib Wood,,0.2,Yes
C550 V2,"Jotul North America (Jotul U.S.A., Inc.)",1.9,1.1,36214-11757,36214,11757,77,Wood Stove,Catalytic Stove,Crib Wood,,0.3,Yes
"Breckwell and Golden Eagle: SP22E, SP22Ei, 5040E and 5040Ei ",United States Stove Company,Not Applicable,1.3,26724-7177,26724,7177,75,Pellet Stove,Non-Catalytic Stove,Wood Pellets,,0.23,Yes
"Supero, Ignis, Calor",J. A. Roby Inc. ,1.397,1.5,20184-12704,20184,12704,71,Wood Stove,Non-Catalytic Stove,Crib Wood,,1.2,Yes
"SR-3.2 Series: St-Louis, Helia, Elevate, Chambly, HEA200","Stove Builder International, Inc.",3.15,1.8,83857-29605,83857,29605,76,Wood Stove,Non-Catalytic Stove,Crib Wood,Alternate Test Method Used,1.4,Yes
"Breckwell SP24E (Blazer), SP24iE (Blazer)",United States Stove Company,Not Applicable,0.66,22587-5993,22587,5993,77,Pellet Stove,Non-Catalytic Stove,Wood Pellets,,0.03,Yes
"RSF 3600B Series: Pearl 3600B, Perle 3600B, Focus 3600B, Focus 3600Bi","RSF / Industrial Chimney Company, Incorporated",1.6,1.7,25406-11757,25406,11757,70,Wood Stove,Non-Catalytic Stove,Crib Wood,,1.3,Yes
Deerfield II,"Travis Industries, Inc",Not Applicable,1.5,37118-15666,37118,15666,80,Pellet Stove,Non-Catalytic Stove,Wood Pellets,,0.128,Yes
Fireview Soapstone Stove 205b,"Woodstock Soapstone Company, Inc.",1.85,1.6,56499-10590,56499,10590,77,Wood Stove,Catalytic Stove,Crib Wood,,0.9,Yes
"5660, AP5660E, US5660, VG5660, SP566, 5660-W, AP5660-W, US5660-W, VG5660-W,
5660-KIT, AP5660-KIT, US5660-KIT, VG5660-KIT,  CGPS1525",United States Stove Company,Not Applicable,1.7,29876-10100,29876,10100,75,Pellet Stove,Non-Catalytic Stove,Wood Pellets,,0.16,Yes
"Montecito-C Series: Montecito-C, WCT6920WSS, Bainbridge-B, WCT4920WSS",Innovative Hearth Products,2.19,1.5,81385-14463,81385,14463,61,Wood Stove,Non-Catalytic Stove,Cord Wood,,0.8,Yes
"Nova 2C, Nova 2C Tower",MF Fire,2.33,1.4,21009-19012,21009,19012,78,Wood Stove,Catalytic Stove,Cord Wood,,0.515,Yes
Vermont Castings by Forge and Flame Dauntless-C,Hearth and Home Technologies,1.82,1.7,21356-13560,21356,13560,75,Wood Stove,Catalytic Stove,Crib Wood,,1,Yes
Progress Hybrid 209b,"Woodstock Soapstone Company, Inc.",2.8,0.46,35222-15257,35222,15257,80,Wood Stove,Hybrid,Crib Wood,,0.07,Yes
"1410B, 1440B, 1450B",Morso Jernstoberi A/S,0.74,1.8,24733-13250,24733,13250,73,Wood Stove,Non-Catalytic Stove,Crib Wood,,0.95,Yes
"2.3 Series (Archway 2300, FW2900, Gateway 2300, Green Mountain Insert 70, Escape 
1800, Inspire 2000, Inspire 2000-I, Matrix, Escape 1800-I, Osburn 2000, Osburn 2000-I, 
Harmony 2.3, Solution 2.3, Solution 2.3-I, CW2900, Destination 2.3-I, Matrix-I, HES240, 
HEI240, Heritage, Deco Alto, Harmony 2.3-I, Blue Ridge 300P, Blue Ridge 300L, and Blue 
Ridge 300-I)","Stove Builder International, Inc.",1.95,2.3,44500-14200,44500,14200,72,Wood Stove,Non-Catalytic Stove,Cord Wood,,1.1,Yes
"20.2 Series: Ashford 20.2 (AF20.2), 
Chinook 20.2 (CK20.2), Sirocco 20.2 (SC20.2)","Blaze King Industries, Inc.",1.86,1.05,31092-10786,31092,10786,80,Wood Stove,Catalytic Stove,Crib Wood,,0.57,Yes
